{
  "checkedAt": "2026-10-30T17:25:47Z",
  "contentDigest": "950f1e22c380f52b2ede4d8e74ef7cea5828174a70e168a9dc2b9bbfb6a8d155",
  "countries": {
    "australia": {
      "appreciation": {
        "periodLabel": "2026-Q2",
        "rate": 0.0826,
        "sourceName": "国际清算银行选定住宅房价",
        "sourceUrl": "https://stats.bis.org/api/v1/data/WS_SPP/Q.AU.N.771?startPeriod=2023-Q1&format=csv"
      },
      "buyingCostRate": 0.05,
      "confidence": "low",
      "methodologyNote": "地方 council rates 与州级转让税采用全国代表值；自住房通常可享州土地税豁免，州和价格区间差异很大。",
      "mortgageRate": {
        "periodLabel": "31/08/2026",
        "rate": 0.062,
        "sourceName": "澳洲央行新发放自住房贷利率",
        "sourceUrl": "https://www.rba.gov.au/statistics/tables/csv/f6-data.csv"
      },
      "propertyTaxRate": 0.006,
      "rentGrowth": {
        "periodLabel": "2024",
        "rate": 0.0707,
        "sourceName": "OECD 实际房租",
        "sourceUrl": "https://sdmx.oecd.org/public/rest/data/OECD.SDD.TPS,DSD_PRICES@DF_PRICES_ALL,1.0/AUS.A.N.CPI.PA.CP041.N.GY"
      },
      "sellingCostRate": 0.03,
      "sources": [
        {
          "name": "Australian Taxation Office：Property",
          "url": "https://www.ato.gov.au/individuals-and-families/investments-and-assets/property"
        },
        {
          "name": "Revenue NSW：Transfer duty",
          "url": "https://www.revenue.nsw.gov.au/taxes-duties-levies-royalties/transfer-duty"
        }
      ],
      "verifiedAt": "2026-10-29"
    },
    "canada": {
      "appreciation": {
        "periodLabel": "2026-Q2",
        "rate": -0.0397,
        "sourceName": "国际清算银行选定住宅房价",
        "sourceUrl": "https://stats.bis.org/api/v1/data/WS_SPP/Q.CA.N.771?startPeriod=2023-Q1&format=csv"
      },
      "buyingCostRate": 0.03,
      "confidence": "low",
      "methodologyNote": "采用加拿大城市住宅的代表性有效地税及成交成本；省、市土地转让税和代理费用差异显著。",
      "mortgageRate": {
        "periodLabel": "2026-10-07",
        "rate": 0.0619,
        "sourceName": "加拿大央行 5 年期按揭挂牌利率",
        "sourceUrl": "https://www.bankofcanada.ca/valet/observations/V80691335/json?recent=4"
      },
      "propertyTaxRate": 0.01,
      "rentGrowth": {
        "periodLabel": "2024",
        "rate": 0.0792,
        "sourceName": "OECD 实际房租",
        "sourceUrl": "https://sdmx.oecd.org/public/rest/data/OECD.SDD.TPS,DSD_PRICES@DF_PRICES_ALL,1.0/CAN.A.N.CPI.PA.CP041.N.GY"
      },
      "sellingCostRate": 0.05,
      "sources": [
        {
          "name": "Statistics Canada：Property taxes and other special charges",
          "url": "https://www.statcan.gc.ca/en/subjects-start/housing"
        },
        {
          "name": "Government of Canada：Buying a home",
          "url": "https://www.canada.ca/en/financial-consumer-agency/services/buying-home.html"
        }
      ],
      "verifiedAt": "2026-10-29"
    },
    "chinaMainland": {
      "appreciation": {
        "periodLabel": "2026-Q2",
        "rate": -0.059,
        "sourceName": "国际清算银行选定住宅房价",
        "sourceUrl": "https://stats.bis.org/api/v1/data/WS_SPP/Q.CN.N.771?startPeriod=2023-Q1&format=csv"
      },
      "buyingCostRate": 0.025,
      "confidence": "medium",
      "methodologyNote": "普通个人非经营自住房按全国通常免征年度房产税；买入采用首套契税及代表性登记、服务成本，上海和重庆试点等特殊情形应手动调整。",
      "mortgageRate": {
        "periodLabel": "2026-10-20",
        "rate": 0.035,
        "sourceName": "5 年期以上 LPR",
        "sourceUrl": "https://www.chinamoney.com.cn/dqs/rest/cm-u-bk-currency/LprHis"
      },
      "propertyTaxRate": 0.0,
      "rentGrowth": {
        "periodLabel": "2026-09",
        "rate": -0.006,
        "sourceName": "国家统计局租赁房房租",
        "sourceUrl": "https://www.stats.gov.cn/sj/zxfb/202610/t20261014_1965477.html"
      },
      "sellingCostRate": 0.025,
      "sources": [
        {
          "name": "中国政府网：住房交易契税政策",
          "url": "https://www.gov.cn/zhengce/zhengceku/202411/content_6986750.htm"
        },
        {
          "name": "国家税务总局深圳市税务局：个人自住房屋房产税",
          "url": "https://shenzhen.chinatax.gov.cn/sztax/zcwj/rdwd/202412/0630f87cd1d64dc99421230628cf48eb.shtml"
        }
      ],
      "verifiedAt": "2026-10-29"
    },
    "france": {
      "appreciation": {
        "periodLabel": "2026-Q2",
        "rate": -0.0079,
        "sourceName": "国际清算银行选定住宅房价",
        "sourceUrl": "https://stats.bis.org/api/v1/data/WS_SPP/Q.FR.N.771?startPeriod=2023-Q1&format=csv"
      },
      "buyingCostRate": 0.075,
      "confidence": "medium",
      "methodologyNote": "Taxe foncière 由地方决定，采用全国代表性市值有效率；买入按普通二手住宅 mutation、登记和公证成本估算。",
      "mortgageRate": {
        "periodLabel": "2026-08",
        "rate": 0.032,
        "sourceName": "ECB 新发放住房贷款利率",
        "sourceUrl": "https://data-api.ecb.europa.eu/service/data/MIR/M.FR.B.A2C.AM.R.A.2250.EUR.N?format=jsondata&lastNObservations=1"
      },
      "propertyTaxRate": 0.01,
      "rentGrowth": {
        "periodLabel": "2025",
        "rate": 0.0232,
        "sourceName": "OECD 实际房租",
        "sourceUrl": "https://sdmx.oecd.org/public/rest/data/OECD.SDD.TPS,DSD_PRICES@DF_PRICES_ALL,1.0/FRA.A.N.CPI.PA.CP041.N.GY"
      },
      "sellingCostRate": 0.05,
      "sources": [
        {
          "name": "Service-Public：Taxe foncière",
          "url": "https://www.service-public.gouv.fr/particuliers/vosdroits/F59"
        },
        {
          "name": "impots.gouv.fr：Achat immobilier",
          "url": "https://www.impots.gouv.fr/particulier/achat-dans-le-neuf"
        }
      ],
      "verifiedAt": "2026-10-29"
    },
    "germany": {
      "appreciation": {
        "periodLabel": "2026-Q2",
        "rate": 0.006,
        "sourceName": "国际清算银行选定住宅房价",
        "sourceUrl": "https://stats.bis.org/api/v1/data/WS_SPP/Q.DE.N.771?startPeriod=2023-Q1&format=csv"
      },
      "buyingCostRate": 0.08,
      "confidence": "low",
      "methodologyNote": "2025 改革后的 Grundsteuer 仍受州模型和市镇乘数影响；买入采用州转让税、登记、公证和代表性服务费中值。",
      "mortgageRate": {
        "periodLabel": "2026-08",
        "rate": 0.04,
        "sourceName": "ECB 新发放住房贷款利率",
        "sourceUrl": "https://data-api.ecb.europa.eu/service/data/MIR/M.DE.B.A2C.AM.R.A.2250.EUR.N?format=jsondata&lastNObservations=1"
      },
      "propertyTaxRate": 0.0035,
      "rentGrowth": {
        "periodLabel": "2025",
        "rate": 0.0211,
        "sourceName": "OECD 实际房租",
        "sourceUrl": "https://sdmx.oecd.org/public/rest/data/OECD.SDD.TPS,DSD_PRICES@DF_PRICES_ALL,1.0/DEU.A.N.CPI.PA.CP041.N.GY"
      },
      "sellingCostRate": 0.03,
      "sources": [
        {
          "name": "Bundesfinanzministerium：Grundsteuerreform",
          "url": "https://www.bundesfinanzministerium.de/Content/DE/FAQ/faq-die-neue-grundsteuer.html"
        }
      ],
      "verifiedAt": "2026-10-29"
    },
    "hongKong": {
      "appreciation": {
        "periodLabel": "2026-Q2",
        "rate": 0.1207,
        "sourceName": "国际清算银行选定住宅房价",
        "sourceUrl": "https://stats.bis.org/api/v1/data/WS_SPP/Q.HK.N.771?startPeriod=2023-Q1&format=csv"
      },
      "buyingCostRate": 0.0325,
      "confidence": "medium",
      "methodologyNote": "以普通住宅的差饷及适用政府地租折算为市值有效率；买入以中档住宅从价印花税加代表性法律及代理成本估算。",
      "mortgageRate": {
        "periodLabel": "2026-09-30",
        "rate": 0.0431,
        "sourceName": "1 个月 HIBOR + 预设利差估算",
        "sourceUrl": "https://api.hkma.gov.hk/public/market-data-and-statistics/monthly-statistical-bulletin/er-ir/hk-interbank-ir-daily"
      },
      "propertyTaxRate": 0.003,
      "rentGrowth": {
        "periodLabel": "2026-09",
        "rate": 0.004,
        "sourceName": "统计处私人住宅租金",
        "sourceUrl": "https://www.censtatd.gov.hk/wbr/B1060001/B10600012026MM09/att/en/B10600012026MM09.pdf"
      },
      "sellingCostRate": 0.012,
      "sources": [
        {
          "name": "香港差饷物业估价署：差饷",
          "url": "https://www.rvd.gov.hk/en/our_services/rates.html"
        },
        {
          "name": "香港政府一站通：印花税收费",
          "url": "https://www.gov.hk/tc/residents/taxes/stamp/stamp_duty_rates.htm"
        }
      ],
      "verifiedAt": "2026-10-29"
    },
    "italy": {
      "appreciation": {
        "periodLabel": "2026-Q2",
        "rate": 0.0399,
        "sourceName": "国际清算银行选定住宅房价",
        "sourceUrl": "https://stats.bis.org/api/v1/data/WS_SPP/Q.IT.N.771?startPeriod=2023-Q1&format=csv"
      },
      "buyingCostRate": 0.06,
      "confidence": "medium",
      "methodologyNote": "普通非豪宅主要自住房通常免 IMU；买入采用 prima casa 税收优惠及代表性公证、登记和服务成本。",
      "mortgageRate": {
        "periodLabel": "2026-08",
        "rate": 0.0358,
        "sourceName": "ECB 新发放住房贷款利率",
        "sourceUrl": "https://data-api.ecb.europa.eu/service/data/MIR/M.IT.B.A2C.AM.R.A.2250.EUR.N?format=jsondata&lastNObservations=1"
      },
      "propertyTaxRate": 0.0,
      "rentGrowth": {
        "periodLabel": "2025",
        "rate": 0.0382,
        "sourceName": "OECD 实际房租",
        "sourceUrl": "https://sdmx.oecd.org/public/rest/data/OECD.SDD.TPS,DSD_PRICES@DF_PRICES_ALL,1.0/ITA.A.N.CPI.PA.CP041.N.GY"
      },
      "sellingCostRate": 0.03,
      "sources": [
        {
          "name": "Dipartimento Finanze：Abitazione principale",
          "url": "https://www.finanze.gov.it/it/fiscalita/fiscalita-regionale-e-locale/Imposta-municipale-propria-IMU/disciplina-del-tributo/abitazione-principale/"
        },
        {
          "name": "Agenzia Entrate：Guida acquisto casa",
          "url": "https://www.agenziaentrate.gov.it/portale/web/english/nse/individuals/property"
        }
      ],
      "verifiedAt": "2026-10-29"
    },
    "japan": {
      "appreciation": {
        "periodLabel": "2025-Q4",
        "rate": 0.0504,
        "sourceName": "国际清算银行选定住宅房价",
        "sourceUrl": "https://stats.bis.org/api/v1/data/WS_SPP/Q.JP.N.771?startPeriod=2023-Q1&format=csv"
      },
      "buyingCostRate": 0.06,
      "confidence": "medium",
      "methodologyNote": "固定资产税和都市计划税按评估值及住宅用地减免折算为市值有效率；交易成本含登记、取得税及代表性服务费。",
      "mortgageRate": {
        "periodLabel": "2026-10",
        "rate": 0.0383,
        "sourceName": "Flat 35 当月利率",